{
  "$schema": "http://json-schema.org/draft-07/schema#",
  "$id": "https://kreile.internal/schemas/module-manifest.schema.json",
  "title": "Module Manifest",
  "description": "Declares the public boundary of one modular slice of the Kreile app: what it exports for other modules to consume, what database and storage objects it owns, what domain events it emits/consumes, and what it depends on. Pre-Path-1 manifests live under docs/architecture/modules/<moduleId>.manifest.json (documentation-as-data, F0-07). Path 1 modules (ARCHITEKTUR_MODULE_PATH1.md) carry their manifest INSIDE the module as src/modules/<moduleId>/<moduleId>.manifest.json; there it is CI-enforced by scripts/quality/check-module-gates.mjs (S1): moduleId == folder, public.ts exists, publicExports = '@/modules/<moduleId>/public#Symbol'.",
  "type": "object",
  "additionalProperties": false,
  "required": ["moduleId", "version", "owner"],
  "properties": {
    "moduleId": {
      "type": "string",
      "description": "Stable, unique identifier for the module, kebab-case.",
      "pattern": "^[a-z][a-z0-9]*(-[a-z0-9]+)*$"
    },
    "version": {
      "type": "string",
      "description": "Version of this manifest's contract (semver). Bump when publicExports, capabilities, or events change in a breaking way.",
      "pattern": "^\\d+\\.\\d+\\.\\d+$"
    },
    "owner": {
      "type": "string",
      "description": "Person, role, or team accountable for this module.",
      "minLength": 1
    },
    "publicExports": {
      "type": "array",
      "description": "Symbols or module paths (e.g. '@/lib/erfassung/snapshot#getKostensatz') that other modules are permitted to import. Anything not listed here is a module-internal implementation detail and must not be imported cross-module.",
      "items": { "type": "string" },
      "default": []
    },
    "capabilities": {
      "type": "array",
      "description": "Named capabilities/permissions this module provides or requires (e.g. 'erfassung:write').",
      "items": { "type": "string" },
      "default": []
    },
    "migrations": {
      "type": "array",
      "description": "Filenames under supabase/migrations/ that this module owns and is responsible for evolving.",
      "items": { "type": "string" },
      "default": []
    },
    "viewsFunctions": {
      "type": "array",
      "description": "Database views and functions this module owns, schema-qualified (e.g. 'public.fn_erfassung_snapshot'). Cross-module read contracts MUST be 'public.v_*' views listed here (Path 1 Naht 4); scripts/quality/check-module-gates.mjs only accepts v_* views that some manifest declares.",
      "items": { "type": "string", "pattern": "^(public|private)\\.[a-z_][a-z0-9_]*$" },
      "default": []
    },
    "ownsTables": {
      "type": "array",
      "description": "Base tables this module owns, schema-qualified ('public.orders', 'private.invoice_numbers'). SQL under src/modules/<moduleId>/ may touch ONLY these tables directly; every other module's facts come in via declared public.v_* views (Path 1 Naht 4, enforced by scripts/quality/check-module-gates.mjs).",
      "items": { "type": "string", "pattern": "^(public|private)\\.[a-z_][a-z0-9_]*$" },
      "default": []
    },
    "storagePurposes": {
      "type": "array",
      "description": "Storage buckets this module owns and what each is used for.",
      "items": {
        "type": "object",
        "additionalProperties": false,
        "required": ["bucket", "purpose"],
        "properties": {
          "bucket": { "type": "string" },
          "purpose": { "type": "string" }
        }
      },
      "default": []
    },
    "events": {
      "type": "object",
      "description": "Domain events this module emits and/or consumes, for future cross-module wiring.",
      "additionalProperties": false,
      "properties": {
        "emits": { "type": "array", "items": { "type": "string" }, "default": [] },
        "consumes": { "type": "array", "items": { "type": "string" }, "default": [] }
      },
      "default": {}
    },
    "config": {
      "type": "object",
      "description": "Module-specific configuration keys (env vars, feature flags) mapped to a short description of each.",
      "additionalProperties": { "type": "string" },
      "default": {}
    },
    "dependencies": {
      "type": "array",
      "description": "moduleId values of other modules this module depends on.",
      "items": { "type": "string" },
      "default": []
    }
  }
}
