{
  "moduleId": "fundament",
  "version": "1.1.1",
  "owner": "Path-1 Fundament (authentifizierter Produkteinstieg)",
  "publicExports": [
    "@/modules/fundament/public#ProductStartProfile",
    "@/modules/fundament/public#SystemAdminView",
    "@/modules/fundament/public#SystemAdminViewProps",
    "@/modules/fundament/public#CompanySettingsInput",
    "@/modules/fundament/public#CompanySettingsSnapshot",
    "@/modules/fundament/public#ManagedUser",
    "@/modules/fundament/public#UpdateManagedUserInput",
    "@/modules/fundament/public#SystemSettingsSnapshot",
    "@/modules/fundament/public#SALES_STAGE_FEATURES",
    "@/modules/fundament/public#isFeatureEnabled",
    "@/modules/fundament/public#SalesStage",
    "@/modules/fundament/public#SalesStageFeature",
    "@/modules/fundament/public#SalesStageFeatureDefinition",
    "@/modules/fundament/public#SalesStageFeatureId",
    "@/modules/fundament/public#ACCESS_AREAS",
    "@/modules/fundament/public#ACCESS_AREA_LABELS",
    "@/modules/fundament/public#isAccessAreaAllowedForRole",
    "@/modules/fundament/public#AccessArea",
    "@/modules/fundament/public#AppRole",
    "@/modules/fundament/public#CreateManagedUserInput",
    "@/modules/fundament/public#SetUserAreaInput",
    "@/modules/fundament/server-public#SystemSettingsContext",
    "@/modules/fundament/server-public#changeOwnPin",
    "@/modules/fundament/server-public#createManagedUser",
    "@/modules/fundament/server-public#readSystemSettings",
    "@/modules/fundament/server-public#readCompanyDocumentSettings",
    "@/modules/fundament/server-public#setManagedUserArea",
    "@/modules/fundament/server-public#updateCompanySettings",
    "@/modules/fundament/server-public#updateManagedUser",
    "@/modules/fundament/server-public#TenantFeatureContext",
    "@/modules/fundament/server-public#isFeatureEnabled",
    "@/modules/fundament/server-public#readTenantFeatures",
    "@/modules/fundament/server-public#setTenantFeature"
  ],
  "capabilities": [
    "product-actors:fail-closed-status",
    "system-admin:session-status",
    "system-admin:settings-manage"
  ],
  "migrations": ["20261025182920_s1_p1_datenfundament.sql", "20261026190000_s1_p2_feature_switch.sql", "20261028163707_h11_align_access_rights.sql"],
  "viewsFunctions": [],
  "ownsTables": ["public.app_user_rights", "public.app_users", "public.company_settings", "public.tenant_features", "public.ui_events"],
  "storagePurposes": [],
  "events": { "emits": [], "consumes": [] },
  "config": {
    "KREILE_ROLF_APP_USER_ID": "Server-only exact office AppUser binding",
    "KREILE_PHILLIP_APP_USER_ID": "Server-only exact workshop AppUser binding",
    "KREILE_GREGOR_APP_USER_ID": "Server-only exact maintenance AppUser binding"
  },
  "dependencies": []
}
