{
  "moduleId": "orders",
  "version": "1.1.0",
  "owner": "Path-1 Orders (Auftragskarte V8)",
  "publicExports": [
    "@/modules/orders/public#ORDER_ACCOUNTING_STATUS",
    "@/modules/orders/public#ORDER_LIFECYCLE_STATUS",
    "@/modules/orders/public#ORDER_LIFECYCLE_STATUS_SEQUENCE",
    "@/modules/orders/public#OrderAccountingStatus",
    "@/modules/orders/public#OrderCardActionFeedback",
    "@/modules/orders/public#OrderCardActionPorts",
    "@/modules/orders/public#OrderCardModel",
    "@/modules/orders/public#OrderCardPayment",
    "@/modules/orders/public#OrderCardPaymentContext",
    "@/modules/orders/public#OrderCardState",
    "@/modules/orders/public#OrderCardView",
    "@/modules/orders/public#OrderLifecycleStatus",
    "@/modules/orders/public#OrderQueueRow",
    "@/modules/orders/public#OrderQueueRowModel",
    "@/modules/orders/public#OrderStationAttachmentPanel",
    "@/modules/orders/public#OrderStationAttachmentPanelProps",
    "@/modules/orders/public#OrderStationAttachmentPorts",
    "@/modules/orders/public#OrdersListItem",
    "@/modules/orders/public#OrdersHomeProjection",
    "@/modules/orders/public#OrdersHomeSource",
    "@/modules/orders/public#Urgency",
    "@/modules/orders/public#buildOrdersHomeProjection",
    "@/modules/orders/public#getUrgency",
    "@/modules/orders/public#isOrderLifecycleStatus",
    "@/modules/orders/server-public#OrderCancellationClass",
    "@/modules/orders/server-public#OrderTimelinessConsistency",
    "@/modules/orders/server-public#OrderTimelinessFact",
    "@/modules/orders/server-public#OrderTimelinessFacts",
    "@/modules/orders/server-public#OrderTimelinessFactsResult",
    "@/modules/orders/server-public#OrderTimelinessMissingReason",
    "@/modules/orders/server-public#OrderTimelinessRange",
    "@/modules/orders/server-public#OrderTimelinessSource",
    "@/modules/orders/server-public#OrderTimelinessValue",
    "@/modules/orders/server-public#getOrderTimelinessFacts"
  ],
  "capabilities": [],
  "migrations": [
    "20260927120000_b2_order_timeliness_read_contract.sql",
    "20260928090000_b2_order_timeliness_legacy_class.sql",
    "20260928110000_b2_order_timeliness_berlin_zone.sql"
  ],
  "viewsFunctions": [
    "public.v_order_timeliness_orders_v1",
    "public.v_order_timeliness_pickup_events_v1"
  ],
  "ownsTables": [],
  "storagePurposes": [],
  "events": {
    "emits": [],
    "consumes": ["ORDER_PICKED_UP_V1", "ORDER_PICKED_UP_V2"]
  },
  "config": {},
  "dependencies": []
}
