{
  "moduleId": "eingang",
  "version": "1.0.0",
  "owner": "Verkaufsstufe 1 Eingang (Paket/persoenlich)",
  "publicExports": [
    "@/modules/eingang/public#GLOBAL_CREATE_OPEN_EVENT",
    "@/modules/eingang/public#DirectIntakeInput",
    "@/modules/eingang/public#ConvertQuoteInput",
    "@/modules/eingang/public#CreateQuoteInput",
    "@/modules/eingang/public#GlobalCreateConversionResult",
    "@/modules/eingang/public#GlobalCreateCustomerResult",
    "@/modules/eingang/public#GlobalCreateDirectIntakeResult",
    "@/modules/eingang/public#GlobalCreateFlow",
    "@/modules/eingang/public#GlobalCreateIntent",
    "@/modules/eingang/public#GlobalCreateOpenQuotesResult",
    "@/modules/eingang/public#GlobalCreatePorts",
    "@/modules/eingang/public#GlobalCreateQuoteReadResult",
    "@/modules/eingang/public#GlobalCreateQuoteResult",
    "@/modules/eingang/public#GlobalCreateRequest",
    "@/modules/eingang/public#RecognizedCustomerSuggestions",
    "@/modules/eingang/public#findRecognizedCustomers",
    "@/modules/eingang/public#requestGlobalCreate",
    "@/modules/eingang/public#UpdateQuoteInput",
    "@/modules/eingang/server-public#ErfasseAuftragInput",
    "@/modules/eingang/server-public#ErfasseAuftragResult",
    "@/modules/eingang/server-public#EingangCustomerPreflight",
    "@/modules/eingang/server-public#erfasseAuftragAusEingangCommand"
  ],
  "capabilities": ["eingang:auftrag-anlegen"],
  "migrations": ["20261031212320_ap01_intake_item.sql"],
  "viewsFunctions": [],
  "ownsTables": ["public.intake_event", "public.intake_item"],
  "storagePurposes": [],
  "events": {
    "emits": ["ORDER_INTAKE_CREATED_V1"],
    "consumes": []
  },
  "config": {},
  "dependencies": ["customers", "orders", "quotes"]
}
