{
  "moduleId": "werkstatt",
  "version": "1.0.0",
  "owner": "Path-1 Werkstatt (Kontroll-Home)",
  "publicExports": [
    "@/modules/werkstatt/public#WorkshopOrderCard",
    "@/modules/werkstatt/public#WorkshopViewModel",
    "@/modules/werkstatt/public#WerkstattData",
    "@/modules/werkstatt/public#WerkstattHeldCard",
    "@/modules/werkstatt/public#WerkstattKpiSnapshot",
    "@/modules/werkstatt/public#WerkstattSurfaceOrder",
    "@/modules/werkstatt/public#WerkstattViewPorts",
    "@/modules/werkstatt/public#buildWerkstattData",
    "@/modules/werkstatt/public#WerkstattView",
    "@/modules/werkstatt/public#WerkstattLoading"
  ],
  "capabilities": [],
  "migrations": [
    "20260908101500_werkstatt_kpi_view.sql"
  ],
  "viewsFunctions": [
    "public.v_werkstatt_kpis_v1"
  ],
  "ownsTables": [],
  "storagePurposes": [],
  "events": {
    "emits": [],
    "consumes": []
  },
  "config": {},
  "dependencies": []
}
